{
  "pulse": "중동 지정학 긴장이 에너지 가격을 끌어올리며 인플레이션 우려를 다시 부각했고, 빅테크의 대규모 AI 관련 차입은 신용시장 부담을 키웠습니다. 미국 주요 지수는 원유·금리·지정학 리스크가 AI 투자 낙관론을 압도하며 하락 마감했습니다.",
  "highlights": [
    {
      "title": "중동 긴장 격화, 에너지·인플레이션 리스크 부각",
      "summary": "중동 지정학 긴장이 고조되며 Brent가 배럴당 93달러를 넘어서고, 에너지 비용 상승이 인플레이션 기대를 다시 끌어올릴 수 있다는 우려가 커졌습니다."
    },
    {
      "title": "빅테크 AI 차입 확대, 신용시장 압력 가중",
      "summary": "대형 기술기업의 AI 관련 대규모 채권 발행이 이어지며, 한 하이퍼스케일러가 약 600억 달러 규모 신규 부채를 조달했다는 보도가 신용시장 경계를 키웠습니다."
    },
    {
      "title": "매크로 리스크에 미국 주식 하락",
      "summary": "유가 상승, 장기금리 상승, 지정학 불확실성이 AI 인프라 수요에 대한 낙관론을 압도하며 Dow, S&P 500, Nasdaq 등 주요 미국 지수가 하락 마감했습니다."
    }
  ],
  "market_reaction": [
    {
      "label": "미국 주식",
      "value": null,
      "direction": "down"
    },
    {
      "label": "Brent",
      "value": "$93.78",
      "direction": "up"
    },
    {
      "label": "미국 30년물 금리",
      "value": "5.24%",
      "direction": "up"
    }
  ],
  "takeaway": "오늘 시장은 지정학 압력이 원자재를 끌어올리고, 원자재 강세가 인플레이션 우려를 되살리며, 그 매크로 압력이 AI 성장 낙관론과 투자자 관심을 두고 경쟁하는 흐름을 보여줬습니다."
}
